"id","authors","year","title","journal","doi","type","evidence_role","status","population","sample","method","finding","limitations","source_url","last_human_verified"
"grandey-2000","Grandey, A. A.","2000","Emotional Regulation in the Workplace: A New Way to Conceptualize Emotional Labor","Journal of Occupational Health Psychology, 5(1), 95–110","10.1037/1076-8998.5.1.95","integrative conceptual review","基礎理論・測定","peer-reviewed","感情労働研究","理論・実証文献","感情調整過程として感情労働を再構成","表層演技・深層演技、表示規則、個人・組織要因を接続","概念モデル|当時の研究蓄積|感情調整一般と職務要求を分ける","https://doi.org/10.1037/1076-8998.5.1.95","2026-07-12"
"morris-feldman-1996","Morris, J. A., & Feldman, D. C.","1996","The Dimensions, Antecedents, and Consequences of Emotional Labor","Academy of Management Review, 21(4), 986–1010","10.2307/259161","conceptual review","基礎理論・測定","peer-reviewed","感情労働研究","理論文献","感情表出の頻度、注意、種類、不協和を次元化","職務・組織・個人の先行要因と結果を整理","概念論|次元の測定・因果を別途検証","https://doi.org/10.2307/259161","2026-07-12"
"brotheridge-lee-2003","Brotheridge, C. M., & Lee, R. T.","2003","Development and Validation of the Emotional Labour Scale","Journal of Occupational and Organizational Psychology, 76(3), 365–379","10.1348/096317903769647229","scale development and validation","基礎理論・測定","peer-reviewed","サービス職等の就業者","複数標本","感情労働尺度の因子・関連を検証","頻度、強度、多様性、表層・深層演技等を区別","自己報告|英語圏標本|尺度項目は再配布しない","https://doi.org/10.1348/096317903769647229","2026-07-12"
"diefendorff-2005","Diefendorff, J. M., Croyle, M. H., & Gosserand, R. H.","2005","The Dimensionality and Antecedents of Emotional Labor Strategies","Journal of Vocational Behavior, 66(2), 339–357","10.1016/j.jvb.2004.02.001","measurement field study","介入・実証研究","peer-reviewed","顧客対応を行う就業者","複数職種標本","表層・深層・自然な表出と表示規則等を分析","三つの表出戦略が区別され先行要因も異なると報告","横断自己報告中心|職種差|戦略を人格特性にしない","https://doi.org/10.1016/j.jvb.2004.02.001","2026-07-12"
"grandey-gabriel-2015","Grandey, A. A., & Gabriel, A. S.","2015","Emotional Labor at a Crossroads: Where Do We Go from Here?","Annual Review of Organizational Psychology and Organizational Behavior, 2, 323–349","10.1146/annurev-orgpsych-032414-111400","annual review","統合研究","peer-reviewed","感情労働研究","主要研究","感情要求、調整、表出、結果、文脈を統合","概念の混同を整理し多水準・文脈研究を提案","ナラティブレビュー|文化・職種の偏り","https://doi.org/10.1146/annurev-orgpsych-032414-111400","2026-07-12"
"hulsheger-schewe-2011","Hülsheger, U. R., & Schewe, A. F.","2011","On the Costs and Benefits of Emotional Labor: A Meta-Analysis of Three Decades of Research","Journal of Occupational Health Psychology, 16(3), 361–389","10.1037/a0022876","meta-analysis","統合研究","peer-reviewed","感情労働研究","約100研究","感情労働戦略と健康・態度・業績を統合","表層演技・不協和は消耗等と不利に関連し、深層演技の関連は異なる","研究間異質性|自己報告・相関中心|平均効果を個人診断にしない","https://doi.org/10.1037/a0022876","2026-07-12"
"mesmer-magnus-2011","Mesmer-Magnus, J. R., DeChurch, L. A., & Wax, A.","2011","Moving Emotional Labor Beyond Surface and Deep Acting","Organizational Psychology Review, 2(1), 6–53","10.1177/2041386611417746","integrative review","統合研究","peer-reviewed","感情労働研究","主要文献","表層・深層演技だけでない不協和・一致の見方を整理","要求、内的感情、表出の組合せを区別","理論統合|直接的介入効果ではない","https://doi.org/10.1177/2041386611417746","2026-07-12"
"kammeyer-mueller-2013","Kammeyer-Mueller, J. D. et al.","2013","A Meta-Analytic Structural Model of Dispositional Affectivity and Emotional Labor","Personnel Psychology, 66(1), 47–90","10.1111/peps.12009","meta-analytic structural model","統合研究","peer-reviewed","感情労働研究","研究群","気質的感情、表示規則、表層・深層演技、結果を統合","個人傾向と状況要因の複数経路を報告","相関研究中心|構造モデル仮定|採用選抜への単純利用を避ける","https://doi.org/10.1111/peps.12009","2026-07-12"
"scott-barnes-2011","Scott, B. A., & Barnes, C. M.","2011","A Multilevel Field Investigation of Emotional Labor, Affect, Work Withdrawal, and Gender","Academy of Management Journal, 54(1), 116–136","10.5465/amj.2011.59215086","experience sampling field study","介入・実証研究","peer-reviewed","サービス従事者","日誌・複数時点","日々の表層・深層演技、感情、撤退行動等を分析","感情労働は日内・日間で変動し感情・撤退と異なる経路を示す","特定職種|自己報告|性別二分法","https://doi.org/10.5465/amj.2011.59215086","2026-07-12"
"goldberg-grandey-2007","Goldberg, L. S., & Grandey, A. A.","2007","Display Rules versus Display Autonomy: Emotion Regulation, Emotional Exhaustion, and Task Performance in a Call Center Simulation","Journal of Occupational Health Psychology, 12(3), 301–318","10.1037/1076-8998.12.3.301","laboratory simulation","介入・実証研究","peer-reviewed","コールセンター模擬参加者","実験","表示規則と表出裁量を操作し感情調整・消耗・業績を比較","厳格な表示規則が感情調整と消耗へ影響し得ると報告","模擬業務・短期|実職場への一般化","https://doi.org/10.1037/1076-8998.12.3.301","2026-07-12"
"grandey-2012","Grandey, A. A. et al.","2012","Free to Be You and Me: A Climate of Authenticity Alleviates Burnout from Emotional Labor","Journal of Occupational Health Psychology, 17(1), 1–14","10.1037/a0025102","multistudy field research","介入・実証研究","peer-reviewed","顧客対応職","複数研究","真正性風土、感情労働、燃え尽きを分析","本人らしさを許す風土が表層演技の負担を弱める可能性を報告","観察研究中心|真正性概念・文化差|何でも表出してよい意味ではない","https://doi.org/10.1037/a0025102","2026-07-12"
"pugh-2001","Pugh, S. D.","2001","Service with a Smile: Emotional Contagion in the Service Encounter","Academy of Management Journal, 44(5), 1018–1027","10.2307/3069445","field observational study","介入・実証研究","peer-reviewed","銀行窓口の従業員・顧客","観察・顧客評価","従業員の感情表出と顧客感情・サービス評価を分析","肯定的表出が顧客反応と関連する結果を報告","単一業態|観察研究|笑顔強制の健康影響は検証しない","https://doi.org/10.2307/3069445","2026-07-12"
"groth-2009","Groth, M., Hennig-Thurau, T., & Walsh, G.","2009","Customer Reactions to Emotional Labor: The Roles of Employee Acting Strategies and Customer Detection Accuracy","Academy of Management Journal, 52(5), 958–974","10.5465/amj.2009.44634116","multistudy service research","介入・実証研究","peer-reviewed","サービス従業員・顧客","実験・フィールド","表層・深層演技、顧客による検出、評価を分析","顧客の知覚と実際の戦略は一致せず、反応経路が異なると報告","特定サービス場面|検出精度は不完全","https://doi.org/10.5465/amj.2009.44634116","2026-07-12"
"hennig-thurau-2006","Hennig-Thurau, T. et al.","2006","Are All Smiles Created Equal? How Emotional Contagion and Emotional Labor Affect Service Relationships","Journal of Marketing, 70(3), 58–73","10.1509/jmkg.70.3.058","multistudy field research","介入・実証研究","peer-reviewed","サービス接点の従業員・顧客","複数研究","真正性、感情伝染、顧客結果を検討","表出の真正性知覚等が顧客反応に関係すると報告","サービス業中心|短時間接点|健康結果を直接扱わない","https://doi.org/10.1509/jmkg.70.3.058","2026-07-12"
"totterdell-holman-2003","Totterdell, P., & Holman, D.","2003","Emotion Regulation in Customer Service Roles: Testing a Model of Emotional Labor","Journal of Occupational Health Psychology, 8(1), 55–73","10.1037/1076-8998.8.1.55","experience sampling study","介入・実証研究","peer-reviewed","コールセンター従業員","日誌・フィールド調査","状況、調整戦略、感情、目標達成を分析","戦略の利用と感情・業績の関連が状況で異なると報告","単一組織|自己報告・短期","https://doi.org/10.1037/1076-8998.8.1.55","2026-07-12"
"grandey-2003","Grandey, A. A.","2003","When “The Show Must Go On”: Surface Acting and Deep Acting as Determinants of Emotional Exhaustion and Peer-Rated Service Delivery","Academy of Management Journal, 46(1), 86–96","10.2307/30040678","field study","介入・実証研究","peer-reviewed","サービス従業員","自己報告・同僚評価","表層・深層演技、消耗、サービスを分析","表層演技は消耗、深層演技はサービス評価と異なる関連を示す","相関研究|同一時点の変数|職種差","https://doi.org/10.2307/30040678","2026-07-12"
"zapf-2002","Zapf, D.","2002","Emotion Work and Psychological Well-Being","Human Resource Management Review, 12(2), 237–268","10.1016/S1053-4822(02)00048-7","integrative review","統合研究","peer-reviewed","感情労働研究","研究文献","感情要求、不協和、感情調整と健康を整理","感情不協和を重要なストレッサーとして位置付ける","ナラティブレビュー|因果推論の限界","https://doi.org/10.1016/S1053-4822(02)00048-7","2026-07-12"
"gross-1998","Gross, J. J.","1998","The Emerging Field of Emotion Regulation: An Integrative Review","Review of General Psychology, 2(3), 271–299","10.1037/1089-2680.2.3.271","integrative review","基礎理論・測定","peer-reviewed","感情調整研究","基礎研究","感情生成過程に沿って調整戦略を整理","先行焦点型・反応焦点型等の区別を提示","職場直接研究ではない|個人内調整中心","https://doi.org/10.1037/1089-2680.2.3.271","2026-07-12"
"webb-2012","Webb, T. L., Miles, E., & Sheeran, P.","2012","Dealing with Feeling: A Meta-Analysis of the Effectiveness of Strategies Derived from the Process Model of Emotion Regulation","Psychological Bulletin, 138(4), 775–808","10.1037/a0027600","meta-analysis","統合研究","peer-reviewed","感情調整実験研究","研究群","複数の感情調整戦略の効果を統合","戦略の種類・実装により平均効果が異なると報告","職場外研究が多い|短期実験|組織的要求の代替にしない","https://doi.org/10.1037/a0027600","2026-07-12"
"hulsheger-2013","Hülsheger, U. R. et al.","2013","Benefits of Mindfulness at Work: The Role of Mindfulness in Emotion Regulation, Emotional Exhaustion, and Job Satisfaction","Journal of Applied Psychology, 98(2), 310–325","10.1037/a0031313","field and intervention studies","介入・実証研究","peer-reviewed","サービス従事者","日誌・無作為介入を含む複数研究","マインドフルネス、表層演技、消耗、満足を検討","短期介入で感情調整・健康指標の改善可能性を報告","小規模・自己報告|個人介入を職場改善の代替にしない","https://doi.org/10.1037/a0031313","2026-07-12"
"wharton-1993","Wharton, A. S.","1993","The Affective Consequences of Service Work","Work and Occupations, 20(2), 205–232","10.1177/0730888493020002004","field survey","介入・実証研究","peer-reviewed","サービス・非サービス労働者","職業調査","感情労働、統制、仕事結果を比較","感情労働の影響は単純に一様でなく統制・条件に依存すると報告","古い米国標本|職業分類・横断研究","https://doi.org/10.1177/0730888493020002004","2026-07-12"
"bhave-glomb-2016","Bhave, D. P., & Glomb, T. M.","2016","The Role of Occupational Emotional Labor Requirements on the Surface Acting–Job Satisfaction Relationship","Journal of Management, 42(3), 722–741","10.1177/0149206313498900","multilevel occupational study","介入・実証研究","peer-reviewed","複数職業の就業者","職業データ・個人調査","職業レベル感情要求と表層演技・満足の関係を検討","職業要求が個人の表層演技との関係を変えると報告","米国職業分類|観察研究|職業内差を含む","https://doi.org/10.1177/0149206313498900","2026-07-12"
"chen-2024","Chen, C., Huang, Y., & Chu, H.","2024","Relationships between Emotional Labor, Job Burnout, and Emotional Intelligence: An Analysis Combining Meta-Analysis and Structural Equation Modeling","BMC Psychology, 12","10.1186/s40359-024-02167-w","meta-analysis and structural modeling","統合研究","peer-reviewed","感情労働研究","研究群","感情労働、燃え尽き、感情知能の関連を統合","表層・深層演技等と燃え尽きの異なる関連を報告","収録研究の異質性|感情知能を個人責任化しない|因果確定ではない","https://doi.org/10.1186/s40359-024-02167-w","2026-07-12"
"dormann-zapf-2004","Dormann, C., & Zapf, D.","2004","Customer-Related Social Stressors and Burnout","Journal of Occupational Health Psychology, 9(1), 61–82","10.1037/1076-8998.9.1.61","scale and longitudinal field studies","介入・実証研究","peer-reviewed","サービス従業員","複数研究・縦断を含む","過度な要求、曖昧な期待、敵意等と燃え尽きを分析","顧客関連ストレッサーが燃え尽きと関連すると報告","自己報告|職種・国の限定|顧客属性ではなく行動を測る","https://doi.org/10.1037/1076-8998.9.1.61","2026-07-12"
"grandey-2004","Grandey, A. A., Dickter, D. N., & Sin, H.-P.","2004","The Customer Is Not Always Right: Customer Aggression and Emotion Regulation of Service Employees","Journal of Organizational Behavior, 25(3), 397–418","10.1002/job.252","field study","介入・実証研究","peer-reviewed","コールセンター従業員","調査・組織記録","顧客の言語的攻撃、感情調整、欠勤等を分析","顧客攻撃が感情労働・負担・撤退と関連すると報告","単一組織|観察研究|因果方向","https://doi.org/10.1002/job.252","2026-07-12"
"wang-2011","Wang, M. et al.","2011","Daily Customer Mistreatment and Employee Sabotage against Customers: Examining Emotion and Resource Perspectives","Academy of Management Journal, 54(2), 312–334","10.5465/amj.2011.60263093","daily diary field study","介入・実証研究","peer-reviewed","顧客対応従業員","複数時点日誌","顧客不当扱い、否定的感情、資源、顧客への妨害を分析","日々の不当扱いが感情・資源経路を通じ反応と関連","自己報告|報復を正当化しない|特定職種・文化","https://doi.org/10.5465/amj.2011.60263093","2026-07-12"
"skarlicki-2008","Skarlicki, D. P., van Jaarsveld, D. D., & Walker, D. D.","2008","Getting Even for Customer Mistreatment: The Role of Moral Identity in the Relationship between Customer Interpersonal Injustice and Employee Sabotage","Journal of Applied Psychology, 93(6), 1335–1347","10.1037/a0012704","multistudy field and experimental research","介入・実証研究","peer-reviewed","顧客対応従業員・実験参加者","調査・実験","顧客からの対人的不公正と顧客妨害を分析","不当扱いと妨害の関連が個人・状況で異なると報告","妨害自己報告・実験|被害者非難に使わない","https://doi.org/10.1037/a0012704","2026-07-12"
"van-jaarsveld-2010","van Jaarsveld, D. D., Walker, D. D., & Skarlicki, D. P.","2010","The Role of Job Demands and Emotional Exhaustion in the Relationship between Customer and Employee Incivility","Journal of Management, 36(6), 1486–1504","10.1177/0149206310368998","field study","介入・実証研究","peer-reviewed","顧客対応従業員","調査・組織データ","顧客無礼、仕事要求、消耗、従業員無礼を分析","顧客無礼と従業員反応の間に要求・消耗が関係すると報告","観察研究|相互影響|責任転嫁を避ける","https://doi.org/10.1177/0149206310368998","2026-07-12"
"rupp-2008","Rupp, D. E. et al.","2008","Customer (In)Justice and Emotional Labor: The Role of Perspective Taking, Anger, and Emotional Regulation","Journal of Management, 34(5), 903–924","10.1177/0149206307309261","laboratory experiments","介入・実証研究","peer-reviewed","サービス場面の参加者","複数実験","顧客不公正、視点取得、怒り、感情調整を操作・測定","顧客不公正が怒り・感情労働へ影響する経路を報告","実験場面|短期反応|不公正判断の文脈差","https://doi.org/10.1177/0149206307309261","2026-07-12"
"gettman-gelfand-2007","Gettman, H. J., & Gelfand, M. J.","2007","When the Customer Shouldn’t Be King: Antecedents and Consequences of Sexual Harassment by Clients and Customers","Journal of Applied Psychology, 92(3), 757–770","10.1037/0021-9010.92.3.757","field studies","介入・実証研究","peer-reviewed","顧客・取引先と接する労働者","複数組織調査","顧客・取引先による性的嫌がらせの先行要因・結果を分析","第三者からの性的嫌がらせが健康・仕事結果と関連","自己報告|米国標本|性別・交差性の追加検討","https://doi.org/10.1037/0021-9010.92.3.757","2026-07-12"
"yagil-2008","Yagil, D.","2008","When the Customer Is Wrong: A Review of Research on Aggression and Sexual Harassment in Service Encounters","Aggression and Violent Behavior, 13(2), 141–152","10.1016/j.avb.2008.03.002","integrative review","統合研究","peer-reviewed","サービス接点研究","主要研究","顧客攻撃・性的嫌がらせの要因、結果、対処を整理","組織方針・支援・サービス規範の役割を指摘","ナラティブレビュー|研究年代|業種差","https://doi.org/10.1016/j.avb.2008.03.002","2026-07-12"
"harris-reynolds-2003","Harris, L. C., & Reynolds, K. L.","2003","The Consequences of Dysfunctional Customer Behavior","Journal of Service Research, 6(2), 144–161","10.1177/1094670503257044","critical incident field study","介入・実証研究","peer-reviewed","接客従業員","重要事象面接","機能不全な顧客行動の従業員・顧客・組織への影響を質的分析","複数の危害・コスト・波及を整理","回顧・質的研究|英国サービス業|発生率推定ではない","https://doi.org/10.1177/1094670503257044","2026-07-12"
"fisk-2010","Fisk, R. P. et al.","2010","Customers Behaving Badly: A State of the Art Review, Research Agenda and Implications for Practitioners","Journal of Services Marketing, 24(6), 417–429","10.1108/08876041011072537","integrative review","統合研究","peer-reviewed","機能不全顧客行動研究","研究文献","用語・類型・原因・対応を整理","顧客の機能不全行動を多様な形態として整理","サービス研究中心|類型を個人ラベルにしない","https://doi.org/10.1108/08876041011072537","2026-07-12"
"andersson-pearson-1999","Andersson, L. M., & Pearson, C. M.","1999","Tit for Tat? The Spiraling Effect of Incivility in the Workplace","Academy of Management Review, 24(3), 452–471","10.2307/259136","conceptual model","基礎理論・測定","peer-reviewed","職場無礼研究","理論文献","低強度で意図が曖昧な無礼が相互作用で増幅するモデルを提示","無礼のスパイラルと転換点を理論化","概念論|顧客に限定しない|意図を推定しない","https://doi.org/10.2307/259136","2026-07-12"
"hershcovis-barling-2010","Hershcovis, M. S., & Barling, J.","2010","Towards a Multi-Foci Approach to Workplace Aggression: A Meta-Analytic Review of Outcomes from Different Perpetrators","Journal of Organizational Behavior, 31(1), 24–44","10.1002/job.621","meta-analysis","統合研究","peer-reviewed","職場攻撃研究","研究群","上司・同僚・部外者等の加害者別に結果を統合","攻撃の発生源で健康・態度との関連が異なると報告","顧客研究のみではない|自己報告中心|因果確定ではない","https://doi.org/10.1002/job.621","2026-07-12"
"schat-kelloway-2003","Schat, A. C. H., & Kelloway, E. K.","2003","Reducing the Adverse Consequences of Workplace Aggression and Violence: The Buffering Effects of Organizational Support","Journal of Occupational Health Psychology, 8(2), 110–122","10.1037/1076-8998.8.2.110","longitudinal quasi-experimental study","介入・実証研究","peer-reviewed","医療従事者","縦断・支援介入","組織支援と攻撃・暴力後の健康等を分析","組織支援が不利な結果を弱め得ると報告","準実験|特定医療組織|一次予防の代替ではない","https://doi.org/10.1037/1076-8998.8.2.110","2026-07-12"
"leblanc-kelloway-2002","LeBlanc, M. M., & Kelloway, E. K.","2002","Predictors and Outcomes of Workplace Violence and Aggression","Journal of Applied Psychology, 87(3), 444–453","10.1037/0021-9010.87.3.444","field study","介入・実証研究","peer-reviewed","複数職種の労働者","大規模調査","公衆・同僚等からの攻撃の予測要因と結果を分析","加害源ごとに職務要因・健康結果が異なると報告","横断自己報告|カナダ標本|暴力の過少報告","https://doi.org/10.1037/0021-9010.87.3.444","2026-07-12"
"lim-2008","Lim, S., Cortina, L. M., & Magley, V. J.","2008","Personal and Workgroup Incivility: Impact on Work and Health Outcomes","Journal of Applied Psychology, 93(1), 95–107","10.1037/0021-9010.93.1.95","multilevel field study","介入・実証研究","peer-reviewed","労働者・職場集団","複数時点調査","個人・集団レベル無礼と仕事・健康を分析","個人曝露と職場風土の双方が不利な結果と関連","顧客限定ではない|自己報告・観察研究","https://doi.org/10.1037/0021-9010.93.1.95","2026-07-12"
"sliter-2012","Sliter, M., Sliter, K., & Jex, S.","2012","The Employee as a Punching Bag: The Effect of Multiple Sources of Incivility on Employee Withdrawal Behavior and Sales Performance","Journal of Organizational Behavior, 33(1), 121–139","10.1002/job.767","field study","介入・実証研究","peer-reviewed","小売従業員","複数源の無礼・業績データ","顧客・同僚・上司からの無礼と撤退・販売を分析","複数源の無礼が蓄積し仕事結果と関連","単一企業|観察研究|販売指標の限定","https://doi.org/10.1002/job.767","2026-07-12"
"kern-grandey-2009","Kern, J. H., & Grandey, A. A.","2009","Customer Incivility as a Social Stressor: The Role of Race and Racial Identity for Service Employees","Journal of Occupational Health Psychology, 14(1), 46–57","10.1037/a0012684","field study","介入・実証研究","peer-reviewed","サービス従業員","顧客無礼・人種アイデンティティ・健康調査","顧客無礼の負担が人種化された経験と交差する可能性を検討","黒人従業員等で異なる関連を報告","米国・自己報告|人種概念の地域差|属性をリスク得点にしない","https://doi.org/10.1037/a0012684","2026-07-12"
"walker-2014","Walker, D. D., van Jaarsveld, D. D., & Skarlicki, D. P.","2014","Exploring the Effects of Individual Customer Incivility Encounters on Employee Incivility","Journal of Applied Psychology, 99(1), 151–161","10.1037/a0034350","event-based field study","介入・実証研究","peer-reviewed","顧客対応従業員","個別接点の反復測定","顧客無礼後の従業員無礼と文脈・否定的感情を分析","一接点の影響が状況・個人で異なると報告","短期・自己報告|従業員責任へ還元しない","https://doi.org/10.1037/a0034350","2026-07-12"
"schneider-1998","Schneider, B., White, S. S., & Paul, M. C.","1998","Linking Service Climate and Customer Perceptions of Service Quality: Tests of a Causal Model","Journal of Applied Psychology, 83(2), 150–163","10.1037/0021-9010.83.2.150","multilevel field study","介入・実証研究","peer-reviewed","銀行支店の従業員・顧客","支店レベル縦断モデル","サービス風土と顧客のサービス品質知覚を接続","資源・実践・優先を含む風土が顧客知覚と関連","単一企業・観察モデル|顧客満足だけで安全を判断しない","https://doi.org/10.1037/0021-9010.83.2.150","2026-07-12"
"bowen-schneider-2014","Bowen, D. E., & Schneider, B.","2014","A Service Climate Synthesis and Future Research Agenda","Journal of Service Research, 17(1), 5–22","10.1177/1094670513491633","integrative review","統合研究","peer-reviewed","サービス風土研究","主要研究","サービス風土の先行要因・結果・境界を統合","人事・リーダー・資源・顧客結果の多水準接続を整理","サービス成果中心|労働者安全との緊張を別途評価","https://doi.org/10.1177/1094670513491633","2026-07-12"
