"id","authors","year","title","journal","doi","type","evidence_role","status","population","sample","method","finding","limitations","source_url","last_human_verified"
"bakker-demerouti-2007","Bakker, A. B., & Demerouti, E.","2007","The Job Demands–Resources Model: State of the Art","Journal of Managerial Psychology, 22(3), 309–328","10.1108/02683940710733115","integrative review","統合研究","peer-reviewed","仕事要求・資源研究","主要研究","仕事要求から消耗、資源から動機づけへの経路を整理","要求と資源を同時に設計する枠組みを提示","一般理論|顧客対応の直接介入ではない","https://doi.org/10.1108/02683940710733115","2026-07-12"
"nahrgang-2011","Nahrgang, J. D., Morgeson, F. P., & Hofmann, D. A.","2011","Safety at Work: A Meta-Analytic Investigation of Job Demands, Job Resources, Burnout, Engagement, and Safety Outcomes","Journal of Applied Psychology, 96(1), 71–94","10.1037/a0021484","meta-analysis","統合研究","peer-reviewed","労働安全研究","研究群","要求・資源、燃え尽き、エンゲージメント、安全を統合","危険・複雑性等の要求と資源が安全結果に関連","顧客暴力特化ではない|研究間異質性","https://doi.org/10.1037/a0021484","2026-07-12"
"halbesleben-2006","Halbesleben, J. R. B.","2006","Sources of Social Support and Burnout: A Meta-Analytic Test of the Conservation of Resources Model","Journal of Applied Psychology, 91(5), 1134–1145","10.1037/0021-9010.91.5.1134","meta-analysis","統合研究","peer-reviewed","燃え尽き研究","研究群","仕事・仕事外支援と燃え尽き次元を統合","支援源により燃え尽きとの関連が異なると報告","相関研究中心|支援を危険除去の代替にしない","https://doi.org/10.1037/0021-9010.91.5.1134","2026-07-12"
"cortina-magley-2003","Cortina, L. M., & Magley, V. J.","2003","Raising Voice, Risking Retaliation: Events Following Interpersonal Mistreatment in the Workplace","Journal of Occupational Health Psychology, 8(4), 247–265","10.1037/1076-8998.8.4.247","longitudinal field study","介入・実証研究","peer-reviewed","連邦職員","複数時点調査","不当扱い後の発言・沈黙・報復等を分析","申し立て・対処後の報復リスクと健康を報告","顧客限定ではない|米国公務|自己選択","https://doi.org/10.1037/1076-8998.8.4.247","2026-07-12"
"wassell-2009","Wassell, J. T.","2009","Workplace Violence Intervention Effectiveness: A Systematic Literature Review","Safety Science, 47(8), 1049–1055","10.1016/j.ssci.2008.12.001","systematic review","統合研究","peer-reviewed","職場暴力介入研究","介入研究群","暴力予防介入の効果研究を体系整理","多要素介入の可能性と研究の質・比較可能性の不足を指摘","研究数・質の制約|業種差|訓練単独の確証ではない","https://doi.org/10.1016/j.ssci.2008.12.001","2026-07-12"
"lanctot-guay-2014","Lanctôt, N., & Guay, S.","2014","The Aftermath of Workplace Violence among Healthcare Workers: A Systematic Literature Review of the Consequences","Aggression and Violent Behavior, 19(5), 492–501","10.1016/j.avb.2014.07.010","systematic review","統合研究","peer-reviewed","医療従事者","研究群","職場暴力後の心理・身体・仕事上の結果を整理","短期・長期の複数の不利な結果を報告","医療中心|研究デザイン・定義の異質性","https://doi.org/10.1016/j.avb.2014.07.010","2026-07-12"
"geoffrion-2020","Geoffrion, S. et al.","2020","Education and Training for Preventing and Minimizing Workplace Aggression Directed toward Healthcare Workers","Cochrane Database of Systematic Reviews, 2020(9)","10.1002/14651858.CD011860.pub2","systematic review","統合研究","peer-reviewed","医療・福祉従事者","比較介入研究","教育・訓練による攻撃予防・最小化の効果を評価","知識等は改善し得るが暴力発生・傷害への効果は不確実と整理","エビデンス確実性が低い|医療中心|訓練単独にしない","https://doi.org/10.1002/14651858.CD011860.pub2","2026-07-12"
"wood-2019","Wood, A. J. et al.","2019","Good Gig, Bad Gig: Autonomy and Algorithmic Control in the Global Gig Economy","Work, Employment and Society, 33(1), 56–75","10.1177/0950017018785616","qualitative cross-national study","介入・実証研究","peer-reviewed","オンライン・ギグ労働者","複数国インタビュー","自律性、評価、アルゴリズム統制を分析","時間裁量と同時に評価・競争・不安定性による統制を報告","オンラインプラットフォーム中心|質的研究|顧客暴力を直接測らない","https://doi.org/10.1177/0950017018785616","2026-07-12"
"kellogg-2020","Kellogg, K. C., Valentine, M. A., & Christin, A.","2020","Algorithms at Work: The New Contested Terrain of Control","Academy of Management Annals, 14(1), 366–410","10.5465/annals.2018.0174","integrative review","統合研究","peer-reviewed","アルゴリズム管理研究","研究文献","指示、評価、規律等のアルゴリズム統制を整理","可視性・比較・自動評価と労働者の対抗・交渉を整理","顧客対応専用ではない|急速な技術変化","https://doi.org/10.5465/annals.2018.0174","2026-07-12"
"fitzgerald-1997","Fitzgerald, L. F. et al.","1997","Antecedents and Consequences of Sexual Harassment in Organizations: A Test of an Integrated Model","Journal of Applied Psychology, 82(4), 578–589","10.1037/0021-9010.82.4.578","field model test","介入・実証研究","peer-reviewed","女性労働者","複数組織調査","組織風土、性的嫌がらせ、健康・仕事結果を分析","寛容な風土と嫌がらせ、健康・仕事結果の関連を報告","顧客加害に限定しない|性別二分法・自己報告|年代差","https://doi.org/10.1037/0021-9010.82.4.578","2026-07-12"
"cortina-2001","Cortina, L. M. et al.","2001","Incivility in the Workplace: Incidence and Impact","Journal of Occupational Health Psychology, 6(1), 64–80","10.1037/1076-8998.6.1.64","field survey","介入・実証研究","peer-reviewed","公的部門労働者","大規模調査","無礼の経験、属性、健康・仕事結果を分析","低強度の無礼も広く発生し不利な結果と関連","顧客限定ではない|自己報告|意図を確定しない","https://doi.org/10.1037/1076-8998.6.1.64","2026-07-12"
"mhlw-customer-manual","厚生労働省","2022","カスタマーハラスメント対策企業マニュアル等","厚生労働省","","official guidance portal","公式指針・制度","official","日本の事業主・労働者","公式原典","法令・条約・指針の原文確認","事前準備、相談体制、発生時対応、被害者配慮等の基本枠組みを提示","2022年資料|2026年厚生労働省告示第51号と併読|個別法的判断ではない","https://www.mhlw.go.jp/stf/newpage_24067.html","2026-07-12"
"mhlw-harassment-policy-2026","厚生労働省","2026","職場におけるハラスメントの防止のために","厚生労働省","","official current policy portal","公式指針・制度","official","日本の事業主・労働者等","公式原典","法令・条約・指針の原文確認","令和7年法律第63号、2026年10月1日の義務化、2026年指針・通達・Q&Aを案内","2026-07-12確認|施行後の改定・運用を継続確認","https://www.mhlw.go.jp/stf/seisakunitsuite/bunya/koyou_roudou/koyoukintou/seisaku06/index.html","2026-07-12"
"mhlw-customer-guideline-2026","厚生労働省","2026","事業主が職場における顧客等の言動に起因する問題に関して雇用管理上講ずべき措置等についての指針（令和8年厚生労働省告示第51号）","厚生労働省","","binding ministerial guideline","公式指針・制度","official","日本の事業主・労働者・顧客等","公式原典","法令・条約・指針の原文確認","カスタマーハラスメントの三要素、正当な申入れ・合理的配慮との区別、事業主が講ずべき措置等を規定","2026-02-26公布|2026-10-01適用|個別事案は業務性質・社会通念・就業環境侵害を総合判断","https://www.mhlw.go.jp/content/11900000/001662584.pdf","2026-07-12"
"japan-act-63-2025","日本国","2025","労働施策総合推進法等の一部を改正する法律（令和7年法律第63号）","参議院 議案審議情報","","Japanese amending statute","公式指針・制度","official","日本の事業主・労働者・顧客等","公式原典","法令・条約・指針の原文確認","顧客等の社会通念上許容範囲を超える言動による就業環境侵害を防ぐ雇用管理上の措置等を規定","公布2025-06-11|主要なカスタマーハラスメント防止措置は2026-10-01施行|指針・通達・個別適用を確認","https://www.sangiin.go.jp/japanese/joho1/kousei/gian/217/meisai/m217080217050.htm","2026-07-12"
"japan-labor-policy-act","日本国","1966","労働施策の総合的な推進並びに労働者の雇用の安定及び職業生活の充実等に関する法律","e-Gov法令検索","","Japanese statute","公式指針・制度","official","日本の事業主・労働者等","公式原典","法令・条約・指針の原文確認","職場のハラスメント対策等を含む労働施策の枠組みを規定","改正法の施行時点・経過措置・指針を確認","https://laws.e-gov.go.jp/law/341AC0000000132","2026-07-12"
"tokyo-customer-ordinance","東京都","2024","東京都カスタマー・ハラスメント防止条例","東京都","","Tokyo metropolitan ordinance","公式指針・制度","official","東京都内の事業者・就業者・顧客等","公式原典","法令・条約・指針の原文確認","何人もカスタマー・ハラスメントを行ってはならないこと、各主体の責務等を規定","2025-04-01施行|罰則のない理念・責務条例|正当な権利行使・合理的配慮をガイドラインと確認","https://www.hataraku.metro.tokyo.lg.jp/plan/kasuhara_jourei/index.html","2026-07-12"
"tokyo-customer-guideline","東京都","2025","東京都カスタマー・ハラスメント防止ガイドライン","東京都","","official implementation guideline","公式指針・制度","official","東京都内の事業者・就業者・顧客等","公式原典","法令・条約・指針の原文確認","条例の考え方、判断、主体別取組、正当な申出との区別を案内","具体例を機械的な一律判定にしない|業務・障害・言語・緊急性等の事情を確認","https://www.hataraku.metro.tokyo.lg.jp/plan/kasuharashishin/index.html","2026-07-12"
"ilo-c190","International Labour Organization","2019","Violence and Harassment Convention, 2019 (No. 190)","ILO NORMLEX","","international labour convention","公式指針・制度","official","批准国・仕事の世界","公式原典","法令・条約・指針の原文確認","仕事の世界における暴力とハラスメントのない権利と包括的予防・保護を規定","日本の批准・国内法上の適用を別途確認|条約は個別事案の判定を代替しない","https://normlex.ilo.org/dyn/nrmlx_en/f?p=NORMLEXPUB:12100:0::NO::P12100_ILO_CODE:C190","2026-07-12"
"ilo-r206","International Labour Organization","2019","Violence and Harassment Recommendation, 2019 (No. 206)","ILO NORMLEX","","international labour recommendation","公式指針・制度","official","加盟国・仕事の世界","公式原典","法令・条約・指針の原文確認","C190を補完しリスク評価、保護、救済、訓練等の指針を提示","非拘束的勧告|国内制度・業種文脈を確認","https://normlex.ilo.org/dyn/nrmlx_en/f?p=NORMLEXPUB:12100:0::NO::P12100_ILO_CODE:R206","2026-07-12"
"who-mental-health-2022","World Health Organization","2022","WHO Guidelines on Mental Health at Work","World Health Organization","","international guideline","公式指針・制度","official","労働者・事業主・政策担当者","公式原典","法令・条約・指針の原文確認","組織的介入、管理職研修、労働者介入、復職等の推奨を提示","カスタマーハラスメント専用ではない|地域資源・実装能力を確認","https://www.who.int/publications/i/item/9789240053052","2026-07-12"
"ilo-who-brief-2022","World Health Organization & International Labour Organization","2022","Mental Health at Work: Policy Brief","WHO / ILO","","international policy brief","公式指針・制度","official","政府・事業主・労働者組織","公式原典","法令・条約・指針の原文確認","心理社会的リスクを予防し、保護・支援・参加を進める政策枠組みを提示","政策概説|個人治療を代替しない","https://www.who.int/publications/i/item/9789240057944","2026-07-12"
"osha-workplace-violence","Occupational Safety and Health Administration","2026","Workplace Violence","U.S. Department of Labor, OSHA","","official safety guidance portal","公式指針・制度","official","米国の事業主・労働者","公式原典","法令・条約・指針の原文確認","職場暴力の危険認識、予防プログラム、業種別資源を案内","米国制度|日本法上の義務と混同しない|更新日を確認","https://www.osha.gov/workplace-violence","2026-07-12"
"japan-osh-act","日本国","1972","労働安全衛生法","e-Gov法令検索","","Japanese statute","公式指針・制度","official","日本の事業者・労働者等","公式原典","法令・条約・指針の原文確認","労働者の安全と健康の確保、快適な職場環境形成等を規定","個別の適用条文・指針・業種基準を確認","https://laws.e-gov.go.jp/law/347AC0000000057","2026-07-12"
"japan-appi","日本国","2003","個人情報の保護に関する法律","e-Gov法令検索","","Japanese statute","公式指針・制度","official","日本の個人情報取扱事業者・本人等","公式原典","法令・条約・指針の原文確認","録音、映像、通報記録等を含み得る個人情報の取得・利用・安全管理・本人関与を規定","録音・防犯・従業員モニタリングの個別運用は現行指針と専門家へ確認","https://laws.e-gov.go.jp/law/415AC0000000057","2026-07-12"
"japan-disability-act","日本国","2013","障害を理由とする差別の解消の推進に関する法律","e-Gov法令検索","","Japanese statute","公式指針・制度","official","行政機関等・事業者・障害のある人","公式原典","法令・条約・指針の原文確認","不当な差別的取扱いの禁止と合理的配慮等を規定","正当な申出・コミュニケーション上の配慮と安全対応を両立|個別事情を確認","https://laws.e-gov.go.jp/law/425AC0000000065","2026-07-12"
