"id","authors","year","title","journal","doi","type","evidence_role","status","population","sample","method","finding","limitations","source_url","last_human_verified"
"rudolph-2017-crafting","Rudolph, C. W., Katz, I. M., Lavigne, K. N., & Zacher, H.","2017","Job Crafting: A Meta-Analysis of Relationships With Individual Differences, Job Characteristics, and Work Outcomes","Journal of Vocational Behavior, 102, 112–138","10.1016/j.jvb.2017.05.008","meta-analysis","統合研究","peer-reviewed","働く人","先行研究群","ジョブ・クラフティングの先行要因・結果を統合","資源探索、挑戦、要求低減等と仕事結果の関連を整理","相関研究中心|尺度・次元差|組織責任の個人化に注意","https://doi.org/10.1016/j.jvb.2017.05.008","2026-07-12"
"parker-2014","Parker, S. K.","2014","Beyond Motivation: Job and Work Design for Development, Health, Ambidexterity, and More","Annual Review of Psychology, 65, 661–691","10.1146/annurev-psych-010213-115208","integrative review","統合研究","peer-reviewed","働く人","仕事設計研究群","仕事設計と発達・健康・適応等を統合","仕事そのものが学習・能力・健康を形成する視点を提示","レビュー|因果研究の異質性|職務・制度差","https://doi.org/10.1146/annurev-psych-010213-115208","2026-07-12"
"maurer-2003","Maurer, T. J., Weiss, E. M., & Barbeite, F. G.","2003","A Model of Involvement in Work-Related Learning and Development Activity: The Effects of Individual, Situational, Motivational, and Age Variables","Journal of Applied Psychology, 88(4), 707–724","10.1037/0021-9010.88.4.707","field study","介入・実証研究","peer-reviewed","働く人","職場標本","個人・状況・動機・年齢と開発活動を分析","自己効力感、支援、便益認知等と学習参加の関連を報告","観察研究|自己選択|年齢を能力の代理にしない","https://doi.org/10.1037/0021-9010.88.4.707","2026-07-12"
"kooij-2011","Kooij, D. T. A. M., De Lange, A. H., Jansen, P. G. W., Kanfer, R., & Dikkers, J. S. E.","2011","Age and Work-Related Motives: Results of a Meta-Analysis","Journal of Organizational Behavior, 32(2), 197–225","10.1002/job.665","meta-analysis","統合研究","peer-reviewed","幅広い年齢の働く人","先行研究群","年齢と仕事動機の関係を統合","成長、達成、社会、安定等の動機と年齢の平均的関係を整理","横断研究中心|コホート・職種差|個人差が大きい","https://doi.org/10.1002/job.665","2026-07-12"
"ng-2012-age","Ng, T. W. H., & Feldman, D. C.","2012","Evaluating Six Common Stereotypes About Older Workers With Meta-Analytical Data","Personnel Psychology, 65(4), 821–858","10.1111/peps.12003","meta-analysis","統合研究","peer-reviewed","年齢の高い働く人","先行研究群","動機、訓練参加、変化抵抗等の固定観念を統合検証","複数の否定的固定観念が証拠と一致しないと整理","年齢定義・職種差|平均差を個人へ適用しない","https://doi.org/10.1111/peps.12003","2026-07-12"
"ilo-r195","International Labour Organization","2004","Human Resources Development Recommendation, 2004 (No. 195)","International Labour Organization","","international labour recommendation","公式指針・制度","official","成人学習者・働く人・組織・制度","該当なし","公式文書の原則・要件を整理","教育・訓練・生涯学習、能力認証、社会対話、機会均等等の原則を提示","勧告であり条約ではない|国内制度・労使関係を確認","https://normlex.ilo.org/dyn/nrmlx_en/f?p=NORMLEXPUB:12100:0::NO::P12100_ILO_CODE:R195","2026-07-12"
"ilo-c142","International Labour Organization","1975","Human Resources Development Convention, 1975 (No. 142)","International Labour Organization","","international labour convention","公式指針・制度","official","成人学習者・働く人・組織・制度","該当なし","公式文書の原則・要件を整理","職業指導・職業訓練の包括的政策・制度と機会の拡大を定める","批准・国内法を確認|歴史的文書","https://normlex.ilo.org/dyn/nrmlx_en/f?p=NORMLEXPUB:12100:0::NO::P12100_ILO_CODE:C142","2026-07-12"
"ilo-r208","International Labour Organization","2023","Quality Apprenticeships Recommendation, 2023 (No. 208)","International Labour Organization","","international labour recommendation","公式指針・制度","official","成人学習者・働く人・組織・制度","該当なし","公式文書の原則・要件を整理","質の高い徒弟制度について権利、報酬、保護、指導、認証、社会対話等を提示","勧告であり条約ではない|国内制度・雇用関係を確認","https://normlex.ilo.org/dyn/nrmlx_en/f?p=NORMLEXPUB:12100:0::NO::P12100_ILO_CODE:R208","2026-07-12"
"unesco-rale","UNESCO","2015","Recommendation on Adult Learning and Education","UNESCO","","official recommendation","公式指針・制度","official","成人学習者・働く人・組織・制度","該当なし","公式文書の原則・要件を整理","成人学習を生涯学習・権利・包摂・質・参加の観点から提示","国家向け勧告|職場研修専用ではない|国内実装差","https://www.unesco.org/en/legal-affairs/recommendation-adult-learning-and-education","2026-07-12"
"eu-ila-2022","Council of the European Union","2022","Council Recommendation on Individual Learning Accounts","Official Journal of the European Union","","official recommendation","公式指針・制度","official","成人学習者・働く人・組織・制度","該当なし","公式文書の原則・要件を整理","個人学習口座、情報・ガイダンス、認定、訓練休暇、包摂等の政策枠組みを提示","EU勧告|日本へ直接適用されない|財源・制度設計を確認","https://eur-lex.europa.eu/eli/C/2022/243/01/oj/eng","2026-07-12"
"eu-microcred-2022","Council of the European Union","2022","Council Recommendation on a European Approach to Micro-Credentials for Lifelong Learning and Employability","Official Journal of the European Union","","official recommendation","公式指針・制度","official","成人学習者・働く人・組織・制度","該当なし","公式文書の原則・要件を整理","マイクロクレデンシャルの記述要素、質、透明性、携帯性等の共通枠組みを提示","EU勧告|資格価値・労働市場での認知は文脈依存|日本へ直接適用されない","https://eur-lex.europa.eu/eli/C/2022/243/02/oj/eng","2026-07-12"
"unesco-oer","UNESCO","2019","Recommendation on Open Educational Resources (OER)","UNESCO","","official recommendation","公式指針・制度","official","成人学習者・働く人・組織・制度","該当なし","公式文書の原則・要件を整理","オープン教材の能力形成、支援政策、包摂的アクセス、質、持続可能性等を提示","国家向け勧告|オープンであるだけで学習効果は保証されない","https://www.unesco.org/en/legal-affairs/recommendation-open-educational-resources-oer","2026-07-12"
"ilo-data","International Labour Organization","1997","Protection of Workers’ Personal Data: An ILO Code of Practice","International Labour Organization","","official code of practice","公式指針・制度","official","成人学習者・働く人・組織・制度","該当なし","公式文書の原則・要件を整理","労働者個人データの目的限定、透明性、アクセス等の原則を提示","拘束的条約ではない|国内法を別途確認","https://www.ilo.org/publications/protection-workers%E2%80%99-personal-data-ilo-code-practice","2026-07-12"
"nist-ai-100","National Institute of Standards and Technology","2023","Artificial Intelligence Risk Management Framework (AI RMF 1.0)","NIST AI 100-1","10.6028/NIST.AI.100-1","official risk management framework","公式指針・制度","official technical report","AIを設計・導入・利用する組織","該当なし","公式リスク管理枠組み","AIリスクをGovern・Map・Measure・Manageで扱う枠組みを提示","米国の自発的枠組み|法的義務そのものではない|用途固有評価が必要","https://doi.org/10.6028/NIST.AI.100-1","2026-07-12"
