"id","authors","year","title","journal","doi","type","evidence_role","status","population","sample","method","finding","limitations","source_url","last_human_verified"
"arthur-2003","Arthur, W., Bennett, W., Edens, P. S., & Bell, S. T.","2003","Effectiveness of Training in Organizations: A Meta-Analysis of Design and Evaluation Features","Journal of Applied Psychology, 88(2), 234–245","10.1037/0021-9010.88.2.234","meta-analysis","統合研究","peer-reviewed","組織研修の参加者","先行研究群","研修設計・評価特徴と学習・行動・結果を統合","組織研修の平均的有効性と設計・評価条件を報告","研究・研修の異質性|公開バイアス|受講者選抜","https://doi.org/10.1037/0021-9010.88.2.234","2026-07-12"
"aguinis-2009","Aguinis, H., & Kraiger, K.","2009","Benefits of Training and Development for Individuals and Teams, Organizations, and Society","Annual Review of Psychology, 60, 451–474","10.1146/annurev.psych.60.110707.163505","integrative review","統合研究","peer-reviewed","個人・チーム・組織・社会","先行研究群","研修・能力開発の便益を多水準で統合","学習、業績、組織・社会的便益と条件を整理","レビュー|因果効果の異なる研究を含む|アクセス格差を別途確認","https://doi.org/10.1146/annurev.psych.60.110707.163505","2026-07-12"
"salas-2012","Salas, E., Tannenbaum, S. I., Kraiger, K., & Smith-Jentsch, K. A.","2012","The Science of Training and Development in Organizations: What Matters in Practice","Psychological Science in the Public Interest, 13(2), 74–101","10.1177/1529100612436661","integrative evidence review","統合研究","peer-reviewed","職場研修の参加者・組織","広範な研究群","研修前・中・後の有効条件を統合","ニーズ分析、設計、実践、支援、評価を連続過程として整理","レビュー|個別手法の効果量ではない|実装文脈差","https://doi.org/10.1177/1529100612436661","2026-07-12"
"bell-2017","Bell, B. S., Tannenbaum, S. I., Ford, J. K., Noe, R. A., & Kraiger, K.","2017","100 Years of Training and Development Research: What We Know and Where We Should Go","Journal of Applied Psychology, 102(3), 305–323","10.1037/apl0000147","centennial review","統合研究","peer-reviewed","職場の研修・能力開発","100年間の研究","研究史、主要知見、将来課題を統合","研修を個人・チーム・組織文脈と時間で捉える必要を整理","レビュー|新技術の長期証拠は限定","https://doi.org/10.1037/apl0000147","2026-07-12"
"baldwin-1988","Baldwin, T. T., & Ford, J. K.","1988","Transfer of Training: A Review and Directions for Future Research","Personnel Psychology, 41(1), 63–105","10.1111/j.1744-6570.1988.tb00632.x","integrative review","統合研究","peer-reviewed","研修参加者","先行研究群","研修入力、学習・保持、一般化・維持を統合","受講者、設計、職場環境が転移に関係する枠組みを提示","古典レビュー|効果量統合ではない","https://doi.org/10.1111/j.1744-6570.1988.tb00632.x","2026-07-12"
"blume-2010","Blume, B. D., Ford, J. K., Baldwin, T. T., & Huang, J. L.","2010","Transfer of Training: A Meta-Analytic Review","Journal of Management, 36(4), 1065–1105","10.1177/0149206309352880","meta-analysis","統合研究","peer-reviewed","研修参加者","先行研究群","個人・設計・環境要因と研修転移を統合","能力、動機、支援、移転気候等と転移の関連を整理","相関研究中心|転移測定・期間の異質性|因果方向","https://doi.org/10.1177/0149206309352880","2026-07-12"
"grossman-2011","Grossman, R., & Salas, E.","2011","The Transfer of Training: What Really Matters","International Journal of Training and Development, 15(2), 103–120","10.1111/j.1468-2419.2011.00373.x","integrative review","統合研究","peer-reviewed","職場研修の参加者","先行研究群","実務的に重要な転移要因を整理","学習保持、行動モデリング、誤り管理、支援、機会等を提示","ナラティブレビュー|要因間の相対効果は限定","https://doi.org/10.1111/j.1468-2419.2011.00373.x","2026-07-12"
"tracey-1995","Tracey, J. B., Tannenbaum, S. I., & Kavanagh, M. J.","1995","Applying Trained Skills on the Job: The Importance of the Work Environment","Journal of Applied Psychology, 80(2), 239–252","10.1037/0021-9010.80.2.239","field study","介入・実証研究","peer-reviewed","研修を受けた従業員","職場標本","継続学習文化、転移気候、研修後行動を分析","職場環境と研修後の適用との関連を報告","観察研究|特定組織・研修|自己報告を含む","https://doi.org/10.1037/0021-9010.80.2.239","2026-07-12"
"sitzmann-2006","Sitzmann, T., Kraiger, K., Stewart, D., & Wisher, R.","2006","The Comparative Effectiveness of Web-Based and Classroom Instruction: A Meta-Analysis","Personnel Psychology, 59(3), 623–664","10.1111/j.1744-6570.2006.00049.x","meta-analysis","統合研究","peer-reviewed","成人・職場等の学習者","先行研究群","Web型と教室型の学習成果等を統合","媒体名だけでなく設計、統制、練習等が結果へ関係すると整理","研究年代|技術変化|参加・離脱差","https://doi.org/10.1111/j.1744-6570.2006.00049.x","2026-07-12"
"colquitt-2000","Colquitt, J. A., LePine, J. A., & Noe, R. A.","2000","Toward an Integrative Theory of Training Motivation: A Meta-Analytic Path Analysis of 20 Years of Research","Journal of Applied Psychology, 85(5), 678–707","10.1037/0021-9010.85.5.678","meta-analysis","統合研究","peer-reviewed","研修参加者","20年間の研究群","訓練動機の先行要因・学習・転移を統合","自己効力感、価値、状況、動機と学習・転移の関連を整理","相関研究を含む|動機を個人責任に還元しない","https://doi.org/10.1037/0021-9010.85.5.678","2026-07-12"
"gegenfurtner-2011","Gegenfurtner, A., Veermans, K., Festner, D., & Gruber, H.","2011","Motivation to Transfer Training: An Integrative Literature Review","Human Resource Development Review, 10(3), 318–348","10.1177/1534484311411075","integrative review","統合研究","peer-reviewed","成人職業学習者","先行研究群","転移動機の定義・先行要因・結果を統合","価値、自己効力感、支援、訓練設計等を整理","レビュー|測定・因果の異質性","https://doi.org/10.1177/1534484311411075","2026-07-12"
"bell-2008","Bell, B. S., & Kozlowski, S. W. J.","2008","Active Learning: Effects of Core Training Design Elements on Self-Regulatory Processes, Learning, and Adaptability","Journal of Applied Psychology, 93(2), 296–316","10.1037/0021-9010.93.2.296","experiment","介入・実証研究","peer-reviewed","複雑課題の学習者","実験参加者","探索、誤りフレーミング、感情統制等を操作","能動的学習設計が自己調整・適応へ作用する条件を報告","実験課題|職場への一般化|個人差","https://doi.org/10.1037/0021-9010.93.2.296","2026-07-12"
"keith-2008","Keith, N., & Frese, M.","2008","Effectiveness of Error Management Training: A Meta-Analysis","Journal of Applied Psychology, 93(1), 59–69","10.1037/0021-9010.93.1.59","meta-analysis","統合研究","peer-reviewed","技能学習者","先行研究群","誤り管理訓練と業績を統合","誤りを学習資源として扱う訓練の平均効果を報告","実験課題を多く含む|安全重要領域は誤り予防を優先","https://doi.org/10.1037/0021-9010.93.1.59","2026-07-12"
"pashler-2008","Pashler, H., McDaniel, M., Rohrer, D., & Bjork, R.","2008","Learning Styles: Concepts and Evidence","Psychological Science in the Public Interest, 9(3), 105–119","10.1111/j.1539-6053.2009.01038.x","systematic evidence review","統合研究","peer-reviewed","学習者","関連研究群","学習スタイル適合仮説に必要な交互作用証拠を検討","好みの型へ教授法を合わせれば学習が改善するという証拠は不足と結論","職場研修専用ではない|好み・アクセシビリティの否定ではない","https://doi.org/10.1111/j.1539-6053.2009.01038.x","2026-07-12"
"cepeda-2006","Cepeda, N. J., Pashler, H., Vul, E., Wixted, J. T., & Rohrer, D.","2006","Distributed Practice in Verbal Recall Tasks: A Review and Quantitative Synthesis","Psychological Bulletin, 132(3), 354–380","10.1037/0033-2909.132.3.354","meta-analysis","統合研究","peer-reviewed","学習者","先行研究群","学習間隔と保持間隔を定量統合","分散学習と長期保持の関係を整理","言語記憶課題中心|職場行動・複雑技能への一般化","https://doi.org/10.1037/0033-2909.132.3.354","2026-07-12"
"dunlosky-2013","Dunlosky, J., Rawson, K. A., Marsh, E. J., Nathan, M. J., & Willingham, D. T.","2013","Improving Students’ Learning With Effective Learning Techniques","Psychological Science in the Public Interest, 14(1), 4–58","10.1177/1529100612453266","systematic evidence review","統合研究","peer-reviewed","主に教育場面の学習者","広範な研究群","10の学習技法の有用性・一般性を評価","練習テストと分散学習等の相対的有用性を整理","学生中心|職場技能・成人学習への直接性制約","https://doi.org/10.1177/1529100612453266","2026-07-12"
"noe-2014","Noe, R. A., Clarke, A. D. M., & Klein, H. J.","2014","Learning in the Twenty-First-Century Workplace","Annual Review of Organizational Psychology and Organizational Behavior, 1, 245–275","10.1146/annurev-orgpsych-031413-091321","integrative review","統合研究","peer-reviewed","働く人","職場学習研究群","正式・非公式学習、技術、キャリアを統合","職場学習を日常経験・関係・技術・自己調整と結ぶ枠組みを提示","レビュー|効果量統合ではない","https://doi.org/10.1146/annurev-orgpsych-031413-091321","2026-07-12"
"cerasoli-2018","Cerasoli, C. P., Alliger, G. M., Donsbach, J. S., Mathieu, J. E., Tannenbaum, S. I., & Orvis, K. A.","2018","Antecedents and Outcomes of Informal Learning Behaviors: A Meta-Analysis","Journal of Business and Psychology, 33, 203–230","10.1007/s10869-017-9492-y","meta-analysis","統合研究","peer-reviewed","働く人","先行研究群","振り返り、試行、探索等の非公式学習行動を統合","個人・状況要因と非公式学習・成果の関連を整理","相関研究中心|概念・尺度の異質性|因果方向","https://doi.org/10.1007/s10869-017-9492-y","2026-07-12"
"tynjala-2008","Tynjälä, P.","2008","Perspectives Into Learning at the Workplace","Educational Research Review, 3(2), 130–154","10.1016/j.edurev.2007.12.001","integrative review","統合研究","peer-reviewed","職場の学習者","複数研究伝統","職場学習の獲得、参加、知識創造視点を統合","個人だけでなく参加・共同体・組織変化として学習を整理","理論レビュー|効果量統合ではない","https://doi.org/10.1016/j.edurev.2007.12.001","2026-07-12"
"marsick-2003","Marsick, V. J., & Watkins, K. E.","2003","Demonstrating the Value of an Organization’s Learning Culture: The Dimensions of the Learning Organization Questionnaire","Advances in Developing Human Resources, 5(2), 132–151","10.1177/1523422303005002002","measurement and validation studies","基礎理論・測定","peer-reviewed","組織構成員","複数組織標本","学習文化の次元と尺度を提示・検討","継続学習、対話、協働、制度、リーダーシップ等を測定","自己報告|文化得点を個人査定に用いない|翻訳・妥当性確認","https://doi.org/10.1177/1523422303005002002","2026-07-12"
"kyndt-2013","Kyndt, E., & Baert, H.","2013","Antecedents of Employees’ Involvement in Work-Related Learning: A Systematic Review","Review of Educational Research, 83(2), 273–313","10.3102/0034654313478021","systematic review","統合研究","peer-reviewed","働く人","先行研究群","仕事関連学習参加の先行要因を体系的整理","個人、仕事、組織条件が学習参加に関係すると整理","研究の異質性|参加と学習成果を区別|因果証拠限定","https://doi.org/10.3102/0034654313478021","2026-07-12"
"derue-2009","DeRue, D. S., & Wellman, N.","2009","Developing Leaders via Experience: The Role of Developmental Challenge, Learning Orientation, and Feedback Availability","Journal of Applied Psychology, 94(4), 859–875","10.1037/a0015317","field study","介入・実証研究","peer-reviewed","管理職・リーダー","職場標本","挑戦的経験、学習志向、フィードバックと発達を分析","挑戦には便益と逓減があり、学習志向・フィードバックが条件と報告","観察研究|管理職中心|過負荷・選抜","https://doi.org/10.1037/a0015317","2026-07-12"
"dragoni-2009","Dragoni, L., Tesluk, P. E., Russell, J. E. A., & Oh, I.-S.","2009","Understanding Managerial Development: Integrating Developmental Assignments, Learning Orientation, and Access to Developmental Opportunities in Predicting Managerial Competencies","Academy of Management Journal, 52(4), 731–743","10.5465/amj.2009.43669936","field study","介入・実証研究","peer-reviewed","管理職","複数組織標本","発達的配置、学習志向、機会アクセスと能力を分析","経験の多様性・挑戦と発達、機会アクセスの重要性を報告","観察研究|管理職中心|機会配分の交絡","https://doi.org/10.5465/amj.2009.43669936","2026-07-12"
"allen-2004","Allen, T. D., Eby, L. T., Poteet, M. L., Lentz, E., & Lima, L.","2004","Career Benefits Associated With Mentoring for Protégés: A Meta-Analysis","Journal of Applied Psychology, 89(1), 127–136","10.1037/0021-9010.89.1.127","meta-analysis","統合研究","peer-reviewed","メンタリングを受ける人","先行研究群","キャリア・心理社会的メンタリングと成果を統合","メンタリングと客観・主観的キャリア成果の平均的関連を報告","相関研究中心|自己選択|制度・非公式の異質性","https://doi.org/10.1037/0021-9010.89.1.127","2026-07-12"
"eby-2008","Eby, L. T., Allen, T. D., Evans, S. C., Ng, T., & DuBois, D. L.","2008","Does Mentoring Matter? A Multidisciplinary Meta-Analysis Comparing Mentored and Non-Mentored Individuals","Journal of Vocational Behavior, 72(2), 254–267","10.1016/j.jvb.2007.04.005","meta-analysis","統合研究","peer-reviewed","若者・学生・職場の被メンタリング者","複数領域の研究群","メンタリング有無と成果を領域横断統合","平均的関連は概して小さく、成果・領域で異なると報告","相関研究中心|選抜|関係の質・害を十分扱わない","https://doi.org/10.1016/j.jvb.2007.04.005","2026-07-12"
"underhill-2006","Underhill, C. M.","2006","The Effectiveness of Mentoring Programs in Corporate Settings: A Meta-Analytical Review of the Literature","Journal of Vocational Behavior, 68(2), 292–307","10.1016/j.jvb.2005.05.003","meta-analysis","統合研究","peer-reviewed","企業のメンタリング参加者","先行研究群","企業メンタリングとキャリア・態度成果を統合","公式・非公式等の条件と平均的関連を整理","研究数・設計の制約|自己選択|長期因果限定","https://doi.org/10.1016/j.jvb.2005.05.003","2026-07-12"
"jones-2016","Jones, R. J., Woods, S. A., & Guillaume, Y. R. F.","2016","The Effectiveness of Workplace Coaching: A Meta-Analysis of Learning and Performance Outcomes From Coaching","Journal of Occupational and Organizational Psychology, 89(2), 249–277","10.1111/joop.12119","meta-analysis","統合研究","peer-reviewed","職場コーチング参加者","先行研究群","コーチングと学習・業績成果を統合","職場コーチングの平均効果と提供者・形式等の条件を報告","研究数・質の差|自己報告|スポンサー利益相反","https://doi.org/10.1111/joop.12119","2026-07-12"
"theeboom-2014","Theeboom, T., Beersma, B., & van Vianen, A. E. M.","2014","Does Coaching Work? A Meta-Analysis on the Effects of Coaching on Individual Level Outcomes in an Organizational Context","The Journal of Positive Psychology, 9(1), 1–18","10.1080/17439760.2013.837499","meta-analysis","統合研究","peer-reviewed","組織内コーチング参加者","先行研究群","業績・技能、ウェルビーイング、対処、態度等を統合","複数成果で平均的正の効果を報告","小標本研究を含む|出版バイアス|コーチング定義差","https://doi.org/10.1080/17439760.2013.837499","2026-07-12"
"ng-2005","Ng, T. W. H., Eby, L. T., Sorensen, K. L., & Feldman, D. C.","2005","Predictors of Objective and Subjective Career Success: A Meta-Analysis","Personnel Psychology, 58(2), 367–408","10.1111/j.1744-6570.2005.00515.x","meta-analysis","統合研究","peer-reviewed","働く人","先行研究群","給与・昇進とキャリア満足等の予測因を統合","客観的成功と主観的成功の予測因が一部異なると整理","相関研究中心|時代・国・職種差|給与中心の限界","https://doi.org/10.1111/j.1744-6570.2005.00515.x","2026-07-12"
"heslin-2005","Heslin, P. A.","2005","Conceptualizing and Evaluating Career Success","Journal of Organizational Behavior, 26(2), 113–136","10.1002/job.270","conceptual and integrative review","基礎理論・測定","peer-reviewed","働く人のキャリア","先行理論・研究","客観・主観、自己・他者基準を整理","キャリア成功を給与・昇進だけでなく本人の基準から評価する枠組みを提示","概念レビュー|測定・文化差を要確認","https://doi.org/10.1002/job.270","2026-07-12"
"seibert-2001","Seibert, S. E., Kraimer, M. L., & Liden, R. C.","2001","A Social Capital Theory of Career Success","Academy of Management Journal, 44(2), 219–237","10.2307/3069452","field study","介入・実証研究","peer-reviewed","組織で働く人","職場標本","ネットワーク構造・資源とキャリア成果を分析","社会関係資本と給与・昇進・満足の経路を報告","観察研究|ネットワーク機会格差|因果方向","https://doi.org/10.2307/3069452","2026-07-12"
"rudolph-2017-career","Rudolph, C. W., Lavigne, K. N., & Zacher, H.","2017","Career Adaptability: A Meta-Analysis of Relationships With Measures of Adaptivity, Adapting Responses, and Adaptation Results","Journal of Vocational Behavior, 98, 17–34","10.1016/j.jvb.2016.09.002","meta-analysis","統合研究","peer-reviewed","学生・働く人","先行研究群","キャリア適応性の先行要因・行動・結果を統合","関心、統制、好奇心、自信と適応行動・結果の関連を整理","相関研究中心|尺度・文化差|個人責任化に注意","https://doi.org/10.1016/j.jvb.2016.09.002","2026-07-12"
"johnston-2018","Johnston, C. S.","2018","A Systematic Review of the Career Adaptability Literature and Future Outlook","Journal of Career Assessment, 26(1), 3–30","10.1177/1069072716679921","systematic review","統合研究","peer-reviewed","学生・働く人","関連研究群","キャリア適応性研究を体系的整理","概念、測定、先行要因、結果、研究課題を提示","自己報告中心|縦断・介入研究不足|文化差","https://doi.org/10.1177/1069072716679921","2026-07-12"
"fugate-2004","Fugate, M., Kinicki, A. J., & Ashforth, B. E.","2004","Employability: A Psycho-Social Construct, Its Dimensions, and Applications","Journal of Vocational Behavior, 65(1), 14–38","10.1016/j.jvb.2003.10.005","conceptual review","基礎理論・測定","peer-reviewed","働く人","先行理論","キャリア・アイデンティティ、適応性、人的・社会的資本を統合","雇用可能性を心理社会的構成概念として提示","概念論文|雇用需要・差別・地域条件を別途確認","https://doi.org/10.1016/j.jvb.2003.10.005","2026-07-12"
"vanderheijde-2006","Van der Heijde, C. M., & Van der Heijden, B. I. J. M.","2006","A Competence-Based and Multidimensional Operationalization and Measurement of Employability","Human Resource Management, 45(3), 449–476","10.1002/hrm.20119","measurement and field studies","基礎理論・測定","peer-reviewed","働く人","複数職場標本","職業専門性、予測・最適化、柔軟性、企業感覚、均衡の尺度を検討","雇用可能性を多次元能力として測定する枠組みを提示","自己・他者評定|国・職種差|雇用可能性を雇用保証と混同しない","https://doi.org/10.1002/hrm.20119","2026-07-12"
"devos-2011","De Vos, A., De Hauw, S., & Van der Heijden, B. I. J. M.","2011","Competency Development and Career Success: The Mediating Role of Employability","Journal of Vocational Behavior, 79(2), 438–447","10.1016/j.jvb.2011.05.010","field study","介入・実証研究","peer-reviewed","組織で働く人","職場標本","能力開発、雇用可能性、キャリア成功を分析","能力開発とキャリア成果の関連に雇用可能性が関与と報告","横断・自己報告を含む|因果方向|特定文脈","https://doi.org/10.1016/j.jvb.2011.05.010","2026-07-12"
"devos-2020","De Vos, A., Van der Heijden, B. I. J. M., & Akkermans, J.","2020","Sustainable Careers: Towards a Conceptual Model","Journal of Vocational Behavior, 117, 103196","10.1016/j.jvb.2018.06.011","conceptual integrative review","基礎理論・測定","peer-reviewed","生涯にわたる働く人","キャリア研究群","個人、文脈、時間、幸福・健康・生産性を統合","持続可能なキャリアを人と文脈の動的適合として提示","概念モデル|介入効果は未確立|価値・制度差","https://doi.org/10.1016/j.jvb.2018.06.011","2026-07-12"
"akkermans-2018","Akkermans, J., Seibert, S. E., & Mol, S. T.","2018","Tales of the Unexpected: Integrating Career Shocks in the Contemporary Careers Literature","SA Journal of Industrial Psychology, 44, a1503","10.4102/sajip.v44i0.1503","conceptual integrative review","基礎理論・測定","peer-reviewed","キャリア上の予期せぬ出来事を経験する人","キャリア研究群","キャリアショックの属性・作用経路を統合","予期せぬ出来事が意図的熟考を通じキャリアへ影響する枠組みを提示","概念論文|出来事・文化差|結果を本人の適応力だけに帰さない","https://doi.org/10.4102/sajip.v44i0.1503","2026-07-12"
"nye-2012","Nye, C. D., Su, R., Rounds, J., & Drasgow, F.","2012","Vocational Interests and Performance: A Quantitative Summary of Over 60 Years of Research","Perspectives on Psychological Science, 7(4), 384–403","10.1177/1745691612449021","meta-analysis","統合研究","peer-reviewed","学生・働く人","60年以上の研究群","職業興味と業績・持続を統合","興味と環境の一致度が業績等の予測に寄与と報告","相関研究|測定・職種差|興味を固定適性にしない","https://doi.org/10.1177/1745691612449021","2026-07-12"
"kristofbrown-2005","Kristof-Brown, A. L., Zimmerman, R. D., & Johnson, E. C.","2005","Consequences of Individuals’ Fit at Work: A Meta-Analysis of Person–Job, Person–Organization, Person–Group, and Person–Supervisor Fit","Personnel Psychology, 58(2), 281–342","10.1111/j.1744-6570.2005.00672.x","meta-analysis","統合研究","peer-reviewed","働く人","先行研究群","複数の適合概念と態度・行動を統合","適合の種類により関連する結果が異なると整理","相関研究中心|知覚適合と客観適合|多様性・同質化リスク","https://doi.org/10.1111/j.1744-6570.2005.00672.x","2026-07-12"
"payne-2007","Payne, S. C., Youngcourt, S. S., & Beaubien, J. M.","2007","A Meta-Analytic Examination of the Goal Orientation Nomological Net","Journal of Applied Psychology, 92(1), 128–150","10.1037/0021-9010.92.1.128","meta-analysis","統合研究","peer-reviewed","学習・仕事課題の遂行者","先行研究群","学習・遂行目標志向の先行要因・結果を統合","目標志向の次元と学習・業績等の関連を整理","相関研究を含む|特性・状態測定差|固定ラベル化に注意","https://doi.org/10.1037/0021-9010.92.1.128","2026-07-12"
"parker-2010","Parker, S. K., & Collins, C. G.","2010","Taking Stock: Integrating and Differentiating Multiple Proactive Behaviors","Journal of Management, 36(3), 633–662","10.1177/0149206308321554","measurement and field studies","基礎理論・測定","peer-reviewed","働く人","職場標本","複数のプロアクティブ行動を区別・測定","職務改善、戦略、環境適合等の能動行動を区別","自己報告|組織反応・権力条件|能動性の強制に注意","https://doi.org/10.1177/0149206308321554","2026-07-12"
"wrzesniewski-2001","Wrzesniewski, A., & Dutton, J. E.","2001","Crafting a Job: Revisioning Employees as Active Crafters of Their Work","Academy of Management Review, 26(2), 179–201","10.5465/amr.2001.4378011","conceptual theory","基礎理論・測定","peer-reviewed","働く人","先行理論","課題・関係・認知の境界変更を理論化","働く人が仕事の意味・アイデンティティを能動的に変える枠組みを提示","概念論文|権限・負担・安全を別途確認","https://doi.org/10.5465/amr.2001.4378011","2026-07-12"
