"id","authors","year","title","journal","doi","type","evidence_role","status","population","sample","method","finding","limitations","source_url","last_human_verified"
"rafferty-2013","Rafferty, A. E., Jimmieson, N. L., & Armenakis, A. A.","2013","Change Readiness: A Multilevel Review","Journal of Management, 39(1), 110–135","10.1177/0149206312457417","multilevel review","統合研究","peer-reviewed","変革準備性研究","主要研究","個人・集団の変革準備性を多層整理","必要性、適切性、能力、支援、便益等を区別","ナラティブレビュー|準備性を服従性にしない","https://doi.org/10.1177/0149206312457417","2026-07-12"
"taras-2010","Taras, V., Kirkman, B. L., & Steel, P.","2010","Examining the Impact of Culture’s Consequences: A Three-Decade, Multilevel, Meta-Analytic Review of Hofstede’s Cultural Value Dimensions","Journal of Applied Psychology, 95(3), 405–439","10.1037/a0018938","meta-analysis","統合研究","peer-reviewed","国民文化価値研究","統合研究群","Hofstede次元と個人・チーム・組織結果を多層統合","国民文化値の関連はレベル・結果・文脈で変わる","国平均を個人へ当てはめない|時代・国内差|組織文化と別","https://doi.org/10.1037/a0018938","2026-07-12"
"gelfand-2011","Gelfand, M. J. et al.","2011","Differences between Tight and Loose Cultures: A 33-Nation Study","Science, 332(6033), 1100–1104","10.1126/science.1197754","cross-national study","介入・実証研究","peer-reviewed","33か国の住民","国際大規模標本","規範の強さと逸脱許容を比較","文化的タイトネス・ルースネスの国差と関連要因を報告","国レベル平均|個人・組織へ直結しない|規範強度を善悪化しない","https://doi.org/10.1126/science.1197754","2026-07-12"
"ashforth-mael-1989","Ashforth, B. E., & Mael, F.","1989","Social Identity Theory and the Organization","Academy of Management Review, 14(1), 20–39","10.2307/258189","conceptual review","基礎理論・測定","peer-reviewed","組織同一視","理論文献","社会的同一視を組織行動へ導入","所属が自己概念・内外集団行動へ関係すると整理","概念論|同一視を忠誠義務にしない","https://doi.org/10.2307/258189","2026-07-12"
"pratt-2000","Pratt, M. G.","2000","The Good, the Bad, and the Ambivalent: Managing Identification among Amway Distributors","Administrative Science Quarterly, 45(3), 456–493","10.2307/2667106","qualitative field study","介入・実証研究","peer-reviewed","販売組織成員","縦断的質的事例","組織同一視を形成する意味づけを分析","同一視管理の複数様式と両義性を報告","単一特殊組織|質的研究|操作的同一視に注意","https://doi.org/10.2307/2667106","2026-07-12"
"who-2022","World Health Organization","2022","WHO Guidelines on Mental Health at Work","World Health Organization","","evidence-based guideline","公式指針・制度","official","労働者・組織","系統的レビューに基づく指針","組織介入、管理職・労働者研修、個人支援、復職等を勧告","文化スローガンでなく心理社会的リスクへの組織介入を重視","各勧告の確実性差|医療的個別助言ではない","https://www.who.int/publications/i/item/9789240053052","2026-07-12"
"iso-45003","International Organization for Standardization","2021","ISO 45003:2021 Psychological Health and Safety at Work","ISO","","international standard guidance","公式指針・制度","official","あらゆる規模・業種の組織","国際規格","心理社会的リスクを労働安全衛生マネジメントで管理する指針","継続的改善と労働者参加を含むシステム対応を提示","規格本文は著作権・有料|認証だけで有効性を証明しない|2026年時点で体系的レビュー中","https://www.iso.org/standard/64283.html","2026-07-12"
"ilo-c155","International Labour Organization","1981","Occupational Safety and Health Convention, 1981 (No. 155)","ILO NORMLEX","","international labour convention","公式指針・制度","official","批准国の労働安全衛生","規範文書","安全衛生の政策・使用者責任・労働者参加等を規定","安全文化を個人意識だけへ還元しない制度基盤","批准・国内実施を確認","https://normlex.ilo.org/dyn/nrmlx_en/f?p=NORMLEXPUB:12100:0::NO::P12100_ILO_CODE:C155","2026-07-12"
"ilo-c187","International Labour Organization","2006","Promotional Framework for Occupational Safety and Health Convention, 2006 (No. 187)","ILO NORMLEX","","international labour convention","公式指針・制度","official","批准国の安全衛生制度","規範文書","予防的安全衛生文化を含む継続的改善枠組みを規定","安全文化を国・組織の制度と参加へ接続","批准・国内実施を確認|標語で代替しない","https://normlex.ilo.org/dyn/nrmlx_en/f?p=NORMLEXPUB:12100:0::NO::P12100_ILO_CODE:C187","2026-07-12"
"ilo-c190","International Labour Organization","2019","Violence and Harassment Convention, 2019 (No. 190)","ILO NORMLEX","","international labour convention","公式指針・制度","official","批准国の仕事の世界","規範文書","暴力・ハラスメントのない仕事の世界への権利と予防・救済を規定","文化を理由に暴力・ハラスメントを容認しない最低線","批准・国内実施を確認","https://normlex.ilo.org/dyn/nrmlx_en/f?p=NORMLEXPUB:12100:0::NO::P12100_ILO_CODE:C190","2026-07-12"
"doj-compliance-2024","U.S. Department of Justice, Criminal Division","2024","Evaluation of Corporate Compliance Programs","U.S. Department of Justice","","official evaluation guidance","公式指針・制度","official","企業コンプライアンス評価","検察向け指針","設計、誠実な適用・資源、実務上の機能という評価観点を提示","方針の存在より、インセンティブ、資源、データ、実効性を問う","米国刑事執行文脈|一般的な文化評価規格ではない|2024年9月版","https://www.justice.gov/criminal/criminal-fraud/page/file/937501/dl","2026-07-12"
"japan-whistleblower","日本国","2004","公益通報者保護法（平成十六年法律第百二十二号）","e-Gov法令検索","","Japanese statute","公式指針・制度","official","日本の公益通報者・事業者等","法令","通報者保護と事業者の体制整備等を規定","「風通しの良い文化」という自己評価で通報体制を代替しない基盤","対象・要件・現行指針を確認","https://laws.e-gov.go.jp/document?lawid=416AC0000000122","2026-07-12"
"mhlw-harassment","厚生労働省","2026","職場におけるハラスメントの防止のために","厚生労働省","","official guidance portal","公式指針・制度","official","日本の事業主・労働者","行政案内・指針","各種ハラスメント防止措置・相談等を案内","「うちの文化」でハラスメントを正当化しない国内制度入口","指針改正・個別該当性を確認","https://www.mhlw.go.jp/stf/seisakunitsuite/bunya/koyou_roudou/koyoukintou/seisaku06/index.html","2026-07-12"
