"id","claim","label","directness","relationship","scope","sources","limits","last_human_verified"
"C76","組織再編・異動・合併・退職・復職では関係喪失と情報断絶を移行リスクとして扱う。","実務原則","基礎・隣接研究","移行期","職場の孤独・所属感・社会的つながり","sluss-2007|morrison-1993","直接的比較研究は限定","2026-07-12"
"C77","休職・復職者への接触は本人の希望、治療・制度、守秘を尊重し、状況説明や返信を強制しない。","実務原則","公式指針・制度","復職接続","職場の孤独・所属感・社会的つながり","who-work-2022|mhlw-kokoro","医療・労務連携|緊急時を除く本人選択","2026-07-12"
"C78","退職者・卒業者ネットワークは任意参加とし、現職者評価や再雇用の秘密スクリーニングへ流用しない。","実務原則","公式指針・制度","アルムナイ","職場の孤独・所属感・社会的つながり","japan-appi","利用目的・保存期間・同意","2026-07-12"
"C79","孤独・孤立対策推進法は社会全体の施策枠組みであり、職場の個別問題を法的義務と断定する根拠にしない。","A","公式指針・制度","国内法の境界","職場の孤独・所属感・社会的つながり","japan-loneliness-law","個別の労務・安衛義務は別法令確認","2026-07-12"
"C80","内閣府全国調査の一般人口推計を、自社の孤独率や職場原因へそのまま転用しない。","A","公式指針・制度","公的統計の限界","職場の孤独・所属感・社会的つながり","cao-survey","職場専用でない|年度・設問・母集団差","2026-07-12"
"C81","全国・地域の相談資源を職場内窓口と接続し、雇用関係に知られず利用できる経路も案内する。","実務原則","公式指針・制度","外部接続","職場の孤独・所属感・社会的つながり","cao-portal|mhlw-kokoro","緊急性・所在地・利用条件を確認","2026-07-12"
"C82","職場のつながりを心理社会的リスク管理の一部とし、安全、仕事要求、統制、支援、関係、役割、変化と統合する。","A","公式指針・制度","安全衛生統合","職場の孤独・所属感・社会的つながり","who-ilo-2022|hse-standards|iso-45003|japan-osh-act|hhs-connection-2023|hhs-workplace-2022","制度・法域差|一般社会と職場の枠組みを区別|規格認証は効果保証でない","2026-07-12"
"C83","従業員支援プログラムの契約有無でなく、認知、待機、費用、守秘、質、継続、職場改善への匿名還元を監査する。","実務原則","公式指針・制度","EAP監査","職場の孤独・所属感・社会的つながり","who-work-2022|mhlw-kokoro","サービス品質データが限定|個人情報保護","2026-07-12"
"C84","所属施策は企画、参加、結果評価に短時間・夜勤・現場・遠隔・派遣・委託・障害のある人を含める。","実務原則","混合","参加の公平性","職場の孤独・所属感・社会的つながり","shore-2011|who-ilo-2022","雇用責任・契約境界|小セル保護","2026-07-12"
"C85","言語・聴覚・発話・感覚・認知特性に合わせ、文字、音声、非同期、手話、平易な表現等の複数経路を用意する。","実務原則","公式指針・制度","アクセシビリティ","職場の孤独・所属感・社会的つながり","who-work-2022|japan-loneliness-law","個別の必要を本人と確認","2026-07-12"
"C86","少数者向けの集まりは当事者が望む安全な空間として支援し、所属や属性の開示・代表役を強制しない。","実務原則","包摂隣接研究","アフィニティ群","職場の孤独・所属感・社会的つながり","shore-2011|japan-appi","組織内権力・守秘|全社制度の代替でない","2026-07-12"
"C87","AIチャットボットやソーシャルロボットを人間関係・専門支援の代替とせず、限界、緊急接続、データ利用、退出を明示する。","不支持","予防原則に基づく推論","AI支援の境界","職場の孤独・所属感・社会的つながり","japan-appi|who-work-2022","独立した職場介入証拠が限定|誤応答・依存・監視","2026-07-12"
"C88","生成AIが会話量や感情語から孤独を検知したとして自動介入・管理職通知・人事判断を行わない。","不支持","予防原則に基づく推論","AI推定禁止","職場の孤独・所属感・社会的つながり","japan-appi","妥当性・同意・要配慮情報|誤警報・見逃し","2026-07-12"
"C89","オンラインコミュニティはアクセスを広げ得るが、モデレーション、嫌がらせ、依存、デジタル格差、勤務時間外負担を評価する。","実務原則","予防原則に基づく推論","オンライン接続","職場の孤独・所属感・社会的つながり","yang-2022|who-ilo-2022","職場介入の比較研究が限定","2026-07-12"
"C90","公開データは定義、母集団、回答率、欠測、時点、勤務形態、小セル処理、禁止用途を伴わせる。","実務原則","公式指針・制度","オープンデータ","職場の孤独・所属感・社会的つながり","cao-survey|japan-appi","再特定・スティグマ化|比較可能性","2026-07-12"
"C91","施策は事前に対象・仮説・実装・成果・中止条件を定め、望まない効果や不参加者への不利益も評価する。","実務原則","混合","評価設計","職場の孤独・所属感・社会的つながり","masi-2011|mcewan-2017|who-work-2022","完全な無作為化が難しい|実装差","2026-07-12"
"C92","短期の好意的満足度だけでなく、3・6・12か月後の関係アクセス、排斥、支援、仕事結果を追う。","実務原則","混合","持続性","職場の孤独・所属感・社会的つながり","masi-2011|ozcelik-2018","離脱・組織変化|長期介入研究が限定","2026-07-12"
"C93","新しい施策が効かなければ参加者の「コミュ力不足」とせず、対象、理論、実装、障壁、危害を見直す。","実務原則","混合","失敗からの学習","職場の孤独・所属感・社会的つながり","masi-2011|who-work-2022","複数要因|否定的結果も公開","2026-07-12"
"C94","研究根拠、設計仮説、現行制度、当事者の選択を分けて表示し、研究がない実務案を確立効果として宣伝しない。","実務原則","予防原則に基づく推論","エビデンス表示","職場の孤独・所属感・社会的つながり","leigh-hunt-2017|who-work-2022","迅速レビューの非網羅性","2026-07-12"
"C95","孤独・所属感の情報を公開するとき、個人名・小集団・関係名簿を開かず、集計と方法・限界・訂正履歴を開く。","実務原則","公式指針・制度","公共性と保護","職場の孤独・所属感・社会的つながり","japan-appi|cao-survey","再特定リスク|本人の尊厳","2026-07-12"
